lemma,surface,pos,frequency,context_gender,context_number,plural,plural_alternatives,plural_candidates,verb_forms,example_sentence,example_cloze,book
hochblicken,hochblickte,VERB,3,,,,,,,"Sein langer silberner Bart und seine Haare schimmerten im Fackellicht, als er sich an Harrys Seite stellte und durch die Halbmondgläser seiner Brille, die auf halber Höhe auf seiner scharfen Hakennase ruhte, zu Fudge hochblickte.","Sein langer silberner Bart und seine Haare schimmerten im Fackellicht, als er sich an Harrys Seite stellte und durch die Halbmondgläser seiner Brille, die auf halber Höhe auf seiner scharfen Hakennase ruhte, zu Fudge {{c1::hochblickte}}.",05_harry_potter_und_der_orden_des_phoenix
knubblig,knubbligen,ADJ,3,,,,,,,"Pansy Parkinson ließ ein kreischendes Lachen hören, das jedoch gleic h in einen Schrei überging, als die Zweige auf dem Tisch in die Luft sprangen und sich als kleine wichtelhafte Geschöpfe aus Holz erwiesen, mit knubbligen braunen Armen und Beinen, zwei zweigartigen Fingern am Ende jeder Hand und einem lustigen flachen, rindenähnlichen Gesicht, in dem ein Paar käferbraune Augen glitzerte.","Pansy Parkinson ließ ein kreischendes Lachen hören, das jedoch gleic h in einen Schrei überging, als die Zweige auf dem Tisch in die Luft sprangen und sich als kleine wichtelhafte Geschöpfe aus Holz erwiesen, mit {{c1::knubbligen}} braunen Armen und Beinen, zwei zweigartigen Fingern am Ende jeder Hand und einem lustigen flachen, rindenähnlichen Gesicht, in dem ein Paar käferbraune Augen glitzerte.",05_harry_potter_und_der_orden_des_phoenix
kringeln,kringelte,VERB,3,,,,,,,"Während es in Flammen aufging, kringelte es sich ein und schwebte zu Boden.","Während es in Flammen aufging, {{c1::kringelte}} es sich ein und schwebte zu Boden.",05_harry_potter_und_der_orden_des_phoenix
listig,listig,ADV,3,,,,,,,Und listig obendrauf.,Und {{c1::listig}} obendrauf.,05_harry_potter_und_der_orden_des_phoenix
pockennarbig,pockennarbigen,ADJ,3,,,,,,,"Augustus Rookwood, hieß es unter einem pockennarbigen Mann mit fettigem Haar, der sich mit gelangweilter Miene gegen den Rand seines Bildes lehnte, verurteilt, weil er Geheimnisse des Zaubereiministeriums an Ihn, dessen Name nicht genannt werden darf, verraten hat.","Augustus Rookwood, hieß es unter einem {{c1::pockennarbigen}} Mann mit fettigem Haar, der sich mit gelangweilter Miene gegen den Rand seines Bildes lehnte, verurteilt, weil er Geheimnisse des Zaubereiministeriums an Ihn, dessen Name nicht genannt werden darf, verraten hat.",05_harry_potter_und_der_orden_des_phoenix
sorry,Sorry,ADV,3,,,,,,,"»Sorry!«, stöhnte Ron und schoss vor, um zu sehen, ob er ihr arg wehgetan hatte.","»{{c1::Sorry}}!«, stöhnte Ron und schoss vor, um zu sehen, ob er ihr arg wehgetan hatte.",05_harry_potter_und_der_orden_des_phoenix
sträubenden,sträubenden,ADJ,3,,,,,,,Auf ihrer Schulter schwankte Hedwig und in den Armen trug sie einen sich sträubenden Krummbein.,Auf ihrer Schulter schwankte Hedwig und in den Armen trug sie einen sich {{c1::sträubenden}} Krummbein.,05_harry_potter_und_der_orden_des_phoenix
umbiegen,umbiegen,VERB,3,,,,,,,"Padma Patil schauderte, und Neville ließ ein merkwürdiges Japsen hören, das er gerade noch zu einem Husten umbiegen konnte.","Padma Patil schauderte, und Neville ließ ein merkwürdiges Japsen hören, das er gerade noch zu einem Husten {{c1::umbiegen}} konnte.",05_harry_potter_und_der_orden_des_phoenix
unschlüssig,unschlüssig,ADV,3,,,,,,,Ron stemmte sich halb hoch und blieb einen Augenblick lang unschlüssig in der Schwebe.,Ron stemmte sich halb hoch und blieb einen Augenblick lang {{c1::unschlüssig}} in der Schwebe.,05_harry_potter_und_der_orden_des_phoenix
willen,willen,ADV,3,,,,,,,"Jedenfalls ist das nicht das Einzige - er hat seine Tante aufgeblasen, um Himmels willen!","Jedenfalls ist das nicht das Einzige - er hat seine Tante aufgeblasen, um Himmels {{c1::willen}}!",05_harry_potter_und_der_orden_des_phoenix
wogende,wogende,ADJ,3,,,,,,,"Harry antwortete nicht, sondern stürzte aus dem Klassenzimmer und bahnte sich einen Weg durch die wogende Menge.","Harry antwortete nicht, sondern stürzte aus dem Klassenzimmer und bahnte sich einen Weg durch die {{c1::wogende}} Menge.",05_harry_potter_und_der_orden_des_phoenix
zuhasten,zugehastet,VERB,3,,,,,,,"Sie hatten sich noch nicht ganz von dem Schock über Lunas Hut erholt, als Angelina auf sie zugehastet kam, begleitet von Katie und Alicia, deren Augenbrauen von Madam Pomfrey glücklicherweise wieder auf ihr normales Maß gestutzt worden waren.","Sie hatten sich noch nicht ganz von dem Schock über Lunas Hut erholt, als Angelina auf sie {{c1::zugehastet}} kam, begleitet von Katie und Alicia, deren Augenbrauen von Madam Pomfrey glücklicherweise wieder auf ihr normales Maß gestutzt worden waren.",05_harry_potter_und_der_orden_des_phoenix
übermitteln,übermitteln,VERB,3,,,,,,,"»Ich bring dich gleich wieder zurück, damit du den anderen die gute Nachricht übermitteln kannst«, sagte er und winkte Harry weiter, während Percys Absätze die Treppe zum neunten Stock hoch verschwanden.","»Ich bring dich gleich wieder zurück, damit du den anderen die gute Nachricht {{c1::übermitteln}} kannst«, sagte er und winkte Harry weiter, während Percys Absätze die Treppe zum neunten Stock hoch verschwanden.",05_harry_potter_und_der_orden_des_phoenix
